{
  "investorID" : "8765432100",
  "lisaManagerReferenceNumber" : "Z543210",
  "PrevLisaInvestorAccountID": "Z543210",
  "PrevLisaManagerReferenceNumber" : "Z543333",
  "transferInDate" : "2015-12-13",

  "accountCreationReason" : "Transferred Account",

  "firstSubscriptionDate" : "2011-02-02",
  "investorNINO":"AB123456D"
}
